{
  "handoff_id": "hp-20260617-cx-01",
  "worker_id": "openai_gpt",
  "created": "2026-06-17T12:00:00.000Z",
  "files_changed": [
    "model-output-evals/worker-output.schema.json",
    "model-output-evals/examples/valid-worker-output.json"
  ],
  "tests_run": [
    "npm.cmd run model-output:validate"
  ],
  "open_questions": [],
  "blocked_items": [],
  "reuse_check_decision": "implement_new",
  "verify_result": "pass"
}
