{
  "handoff_id": "hp-20260617-skill-registry-init",
  "worker_id": "openai_gpt",
  "created": "2026-06-17T14:45:00.000Z",
  "files_changed": [
    "docs/autopilot/skill-registry.json"
  ],
  "tests_run": [
    "npm.cmd run verify"
  ],
  "open_questions": [],
  "blocked_items": [],
  "reuse_check_decision": "implement_new",
  "verify_result": "pass"
}
